CV File,Category,Education,Top Skills
./data\HEALTHCARE\16356151.pdf,HEALTHCARE,"[{'Degree': 'bachelor', 'Major': 'of arts\n \n  \nnursing\n \ngannon university\n \nï¼  \ncity\n \n  \nstate\n \n  \nus\n \nlambda sigma society  gpa  3 85  nxstage us renal care  home\ndialysis education   training  bcls  cpr  trauma certification\nprofessional affiliations\nsgna\naccomplishments\nhighly motivated  dedicated  flexible and compassionate with proven expertise in communication  organization and documentation skills \nvaluable interpersonal skills  forging relationships and collaborating with interdisciplinary teams to develop outstanding care and support and\nto facilitate a friendly and caring environment\nexcellent observation  clinical skills  good clinical judgment  and outstanding oral and written communication skills\nexcelled in early nursing career as rn nurse team leader in home health care  2 1992 to 5 2000  and hospital staff nurse on med \nsurg neuro floor  5 1990 to 2 1992   with commendations for quality of total patient care from community teaching hospital employers \nelected for nurse of the year in 1992\nknown as a loyal team player with an unwavering commitment to providing quality care and preventive medicine advocacy  available for\nfull time employment  preferably day shift\nskills\nhealthcare  training  access  customer service  laboratory  liaison  office management  patent education  â phlebotomy  â scheduling \nteaching  telephone  voice  self directed  cpr  administrative tasks  arrangements  cardiovascular  employee records  environmental health \nergonomics  industrial hygiene  industrial safety  office supplies  sop  sops  testing  community relations  documentation  forging \nmaintenance  oasis  quality assurance  quality control  rn  rn license  rn   team player  wound care  cpr certification  cpr certified \ndialysis  registered nurs', 'University': 'e'}]","health care team, occupational health nurse, patient management patient, develop outstanding care, home health care, physician liaison nurse, health nurse coordinator, patient care assessed, directed patient care, clinical skills good"
./data\HEALTHCARE\16702198.pdf,HEALTHCARE,"[{'Degree': 'bachelor', 'Major': 'of arts\n \n  \nbusiness management\n \ncity\n \n  \nstate\n \n  \nus\n \nnortheastern university  babm  boston  ma\ncertified medical representative\n \n2005\n \ncertification\n \n  \npharmaceuticals\n \ncity\n \n  \nstate\nâ \nprofessional affiliations\nct  ri and maâ case managers societies member\nmember pharmacy association ri  ma and ct\nâ  \ncertifications\ncertified medical representative\nskills\naccount management  key account selling  product expertise  or selling training  budget  business plans  educational programs  market\ntrends  medicaid â business development  managed care  medical device  ms excel  ms powerpoint  ms word  new business\ndevelopment  project management  prospecting  sales presentations  senior sales', 'University': ''}]","medical center hartford, center hartford hospital, baystate medical center, product contest award, contest award winner, key account manager, certified medical representative, divisional product contest, account management medical, cluster business strategies"
./data\HEALTHCARE\17539842.pdf,HEALTHCARE,"[{'Degree': 'master', 'Major': 'assignments and to reinforce learning concepts\npresented by the teachers \nsupervised students in classrooms  halls  cafeterias  school yards  and gymnasiums  or on field trips \npresent subject matter to students under the direction and guidance of teachers  using lectures  discussions  or supervised role playing\nmethods \nobserve students  performance  and record relevant data to assess progress discuss assigned duties with classroom teachers in order to\ncoordinate instructional efforts \ninstruct and monitor students in the use and care of equipment and materials  in order to prevent injuries and damage \nenforce administration policies and rules governing students \nsubstitute teacher\n \naug 2011\n \nto \njun 2014\n \ncompany name\n \nï¼  \ncity\n \n  \nstate\nplanned and directed activities associated with project \ntaught students with emotional impairments \nassisted teaching staff in public elementary  middle and high school \ngraded homework and test  using answer sheets and recorded results \ndistributed teaching materials to students such as textbooks  workbooks  and paper and pencils \nmaintained order with in the school and on school grounds \ntook attendance \nteacher assistant\n \nsep 2010\n \nto \njun 2011\n \ncompany name\n \nï¼  \ncity\n \n  \nstate\nprovided extra assistance to students with special needs  and students with physical and mental disabilities provided extra assistance to students with special needs  and students with physical and mental disabilities \ntutored and assisted children individually or in small groups in order to help those master assignments  and to reinforce learning concepts\npresented by the teachers \nsupervised students in classrooms  halls  cafeterias  school yards  and gymnasiums  or on field trips \npresent subject matter to the students under the direction and guidance of teachers  using lectures  discussions  or supervised role playing\nmethods \nobserve students  performance  and record relevant data to assess progress \ndiscuss assigned duties with classroom teachers in order to coordinate instructional efforts \ninstructed and monitored students in the use and care of equipment and materials  in order to prevent injuries and damage \nenforced administration policies and rules governing students \noffice assistant\n \nfeb 2010\n \nto \napr 2010\n \ncompany name\n \nï¼  \ncity\n \n  \nstate\nchecked to ensure that appropriate changes were made to resolve customers  concerns \ndocumented records of customer concerns and transactions \nrecorded details of inquiries  concerns  comments \nresponded to customers inquires and notified them of claim investigation results \ninput interview information into computer \ncollected deposits and prepared change of address records \nenabled significant improvements in their productivity \nreviewed billing questions  concerns  and forwarded as needed to departments for investigation \nhealthcare technician\n \ndec 2006\n \nto \nmay 2007\n \ncompany name\n \nï¼  \ncity\n \n  \nstate\nanswered signal lights  bells and intercom system to determine patients  needs \nperformed duties in care of patients in nursing home under direction of nursing and medical staff \nserved and collected food trays and fed patients requiring help \ntransported patients  using wheelchair and wheeled cart and assisted patients to walk \nrecorded temperature  blood pressure  pulse  respiration rates  food and fluid intake and output  as directed \nissued medications from dispensary and maintained records \nled prescribed individual and group therapy sessions as part of specific therapeutic procedures \nrestrained  potentially violent  and suicidal patients with verbal and physical methods \ninterviewed new patients to complete admission forms  to assess their mental health status and to obtain their mental health and treatment\nhistory \nencouraged patients to develop work skills and to participate in social  recreational  and other therapeutic activities that enhanced\ninterpersonal skills and developed social relationships \ncertified nursing assistant\n \naug 2005\n \nto \njan 2006\n \ncompany name\n \nï¼  \ncity\n \n  \nstate\nrecorded temperature  blood pressure  pulse  respiration rates  food  and fluid intake and output \ncleaned  sterilized  stored  prepared  and issued dressing packs \ncertified nursing assistant\n \napr 2005\n \nto \nmay 2005\n \ncompany name\n \nï¼  \ncity\n \n  \nstate\nperformed duties in care of patients in their home under direction of nursing and medical staff \nbathed  dressed  and undressed patients \ntransported patients  using wheelchair wheeled cart and assisted patients to walk \nprepared meals  and assisted with activities of daily living \nchanged bed linens  ran errands  directed visitors and answered telephone \norganized and labeled materials \neducation and training\ncertificate in administrative assistant\n \n2016\n \nwake tech community college\n \nï¼  \ncity\n \n  \nstate\ncertificate\n \n2004\n \nwake tech community college\n \nï¼  \ncity\n \n  \nstate\nhigh school diploma\n \n2001\n \ncontinental academy high school\n \nï¼  \ncity\n \n  \nstate\ncertifications\nnursing assistant\nnorth carolina interventions\nskills\norganizational skills written communications skills verbal communication skills cultural awarenessâ  microsoft typing skills ability to focus\nefficiency self motivation ethica', 'University': 'l'}]","teachers supervised students, city state provided, city state answered, teacher assistant sep, city state recorded, methods observe students, observe students performance, students office assistant, city state high, rules governing students"
./data\HEALTHCARE\17545780.pdf,HEALTHCARE,[],"world issues award, awards school diligence, school diligence award, office manager managing, patients nurses doctors, patient care consistently, manager managing director, patient focused care, patient care follow, comprehensive patient care"
./data\HEALTHCARE\17624934.pdf,HEALTHCARE,"[{'Degree': 'bachelor', 'Major': 'of science\n \n  \nnursing\n \nursuline college\n \nï¼  \ncity\n \n  \nstate\nexecutive healthcare management certification\n \ncwru weatherhead\n \nï¼  \ncity\n \n  \nstate\nmba\n \n  \nhealthcare management\n \ncleveland state university\n \nï¼  \ncity\n \n  \nstate\n \n  completed 3 of 4 years course work\npublications presentations\noptimization after implementation\nvalue based billing\ntransforming healthcare\nclinical management redesign\ndeveloping multi disciplinary clinical content\nskills\nseasoned healthcare advisor  excellent communication skills  creative problem solver  innovative critical thinker  leader  change drive', 'University': 'r'}]","specialist leader healthcare, communication skills creative, leading healthcare organizations, manager specialist leader, excellent communication skills, senior manager specialist, creative problem solver, multi year multi, year multi state, multi state multi"
./data\HEALTHCARE\17864043.pdf,HEALTHCARE,[],"business development representatives, corporate regional recruiter, recruitment recruiting recruiter, city state develop, regional recruitment plan, potential employees assisted, city state sourced, city state developed, city state sociology, potential candidates met"
./data\HEALTHCARE\17960690.pdf,HEALTHCARE,"[{'Degree': 'bachelor', 'Major': 's of science\n \n  \nnursing\n \n  \nmay 2000\n \nmississippi college\n \nï¼  \ncity\n \n  \nstate\n \nnursing\nassociate of arts\n \n  \nmay 1997\n \nhinds community college\n \nï¼  \ncity\n \n  \nstate\nskills\nemergency care  palliative care  patient advocate  surgery\nadditional information\nactive member of junior auxiliary from 2006 2011 \nchaired projects including prom closet  buckets of happiness  and dental days\nsought out and implemented a program called  challenge day  in local schools thatâ focused onâ combatting bullying and facilitating a\npositive school culture  managed every aspect of the program including  but not limited to  securing funding  recruiting volunteers  and\nworking with school counselors to identify high risk students \nvolunteer for william s wings  ms diabetes association  and ms march of dime', 'University': 's'}]","registered nurse april, lyrica goal attainment, flector patch goal, neonatal intensive care, intensive care unit, professional healthcare representative, city state surgical, city state nursing, city state skills, patch goal attainment"
./data\HEALTHCARE\17963031.pdf,HEALTHCARE,"[{'Degree': 'master', 'Major': 's\n \n  \ninformation management\n \nwebster university\n \nï¼  \ncity\n \n  \nstate\n \ninformation management\nbachelor of science\n \n  \nhealth education\n \nsouthern illinois university\n \nï¼  \ncity\n \n  \nstate\n \nhealth education\nmay 2004\nmaster of arts\n \n  \ncomputer resource and information management\n \nwebster university\n \ncomputer resource and information management\ncoursework  program management  systems analysis and design  database management  security\n \n  \nbusiness administration\n \nbusiness\nadministration\n1996\nbachelor of arts\n \n  \ncommunity health education\n \nsouthern illinois university edwardsville il\n \ncommunity health education\n1993\nassociate of science\n \nsouthwestern illinois community college\nmay 2004\nmicrosoft certified systems engeneer mcse  microsoft certified systems engineer  certification\n \nmanaging and maintaining a windows server\n2003 environment implementing  managing  and maintaining a windows server 2003 network infrastructure\nmay 2004\nsecurity   certification\nskills\nactive directory  air force  basic  bi  business processes  database management  database  fsa  functional  gui  instruction  java  local\narea network  lan  logistics  managing  materials  access  microsoft certified  microsoft certified systems engineer  mcse  windows \n2000  enterprise  network  networks  organizational  policies  program management  relational databases  risk assessment  standard\noperation procedure  sop  supervisor  systems analysis and design  system integration  technician  telephones  troubleshooting  unix  video \nvista  xm', 'University': 'l'}]","microsoft certified systems, information management webster, bmt division program, program management systems, system administrator assistant, certified systems engineer, data logistics management, management webster university, division program lead, medical system concepts"
./data\HEALTHCARE\18129173.pdf,HEALTHCARE,"[{'Degree': 'bachelor', 'Major': 'of science  bs \n \n  \nradiologic technology biology\n \ncity\n \n  \nstate\n \n  \nunited\nstates\n \ngpa  \ngpa  3 5\nradiologic technology biology gpa  3 5interests\naart license  2001    member  american registered radiologic technologists \ncharitable volunteer coordinator  radiologic science club\nskills\nbiotechnology and pharmaceutical \nsales  administrative  award winner sales professional\nadditional information\ncertifications   affiliations\naart license  2001    member  american registered radiologic technologists\ncharitable volunteer coordinator  radiologic science clu', 'University': 'b'}]","representative city state, coordinator radiologic science, radiologic science club, american registered radiologic, registered radiologic technologists, radiologic technologists charitable, volunteer coordinator radiologic, increased market share, radiologic technology biology, award winner sales"
./data\HEALTHCARE\18365443.pdf,HEALTHCARE,"[{'Degree': 'master', 'Major': 'of science\n \n \n \ncomputer information systems\n \nuniversity of phoenix\n \nï¼  \ncity\n \n  \nstate\n \ncomputer information systems\ngraduate courses in business communications  project management  operating systems  networking  database concepts  software\nengineering  programming management  organization  ethics and intellectual property  and financial management  certified project management\nassociate  international project management association \n ipma  level d   number d15 122834\nskill highlights\n  \nskills\naccounting  accounts receivable  auditing  balance  billing  business communications  business plan  client  clients  client liaison  customer service \nclient support  database  delivery  financials  financial  financial consulting  financial management  focus  insurance  intellectual property \nleadership  mentor  office  2000  nt  networking  operating systems  processes  process improvement  coding  programming  project\nmanagement  proposal  quality  report writing  reporting  revenue recognition  siemens  software engineering  sql  technical support\nprofessional experience\nhighly accomplished healthcare analyst\n \n  \n01 1997\n \nto \ncurrent\n \ncompany name\nproviding operational and financial consulting services  employed through the acquisition of siemens health services by cerner in 2014 and\nthe acquisition of shared medical services by siemens in 2000 primary client liaison assessing business needs from stakeholders at every\nlevel  including executives within the client organization  explaining available standard services and or suggesting methods for customization\nof solutions to enhance production objectives and bring in departmental revenue \nprovide outstanding customer service by quickly addressing any client support issues  escalating new opportunities for revenue improvement\nto the appropriate executives within the organization  and maintaining a line of communications with clients that is advisory in nature and\nexceptional in its execution \nexpertly synthesize client input through a full business discovery process and assemble an internal team of experts in sql  database  report\nwriting  networking to answer questions and develop a set of technical specifications that are presented in a form of an actionable solution\nproposal \nimprove revenue cycle management for clients by providing off the shelf  custom  or client hosted solutions that allow them to off load\nissues and focus on the critical revenue recognition activities of their business office which includes accounts receivable and dealing with\ninsurance companies \nmeticulously review procedures and processes within financial departments and compare those with industry  best practice  standards to\nidentify opportunity for process improvement \nidentify actionable gaps by comparing revenue cycle reporting against other similar organizations as well as nationally recognized key\nperformance indicators  kpis  \nguide a client through the recovery audit contractor  rac  program which requires coding  billing  and reimbursement compliance with\nmedicare \ndevelop reports and create abstracts that pulled insurance  patient balance  and diagnostic related groups  drg  coding from a client s\ninvision patient accounting financial systems that ensured that medicare was not being overbilled and identified coding errors and\nbrought up the issue of medical necessity which led to process improvements \nparticipate as a key technical resource and mentor documenting the entire process of an ongoing customer project now in its 16th month\nwhich transfers 7 10 years of patient accounting data to a third party repository as part of audit requirements to meet a variety of regulatory\nstandards \ncollaborate with the project manager to meet project deadlines so that the client is able to keep their financial system data before the\ncontract elapses while ensuring that the client pays for only the amount of data storage required \naccelerate the delivery of solutions for the client by creating reusable templates that can be shared between projects \ndeliver the technical leadership required for projects of 6 days to 6 months in duration to determine the environment  configuration  and\nbuild programs necessary to decommission legacy systems and efficiently migrate to data to database systems which allow simplified queries\nfor financial posting \nthrough job sharing with the soarian financials test team  recreated software defects and validated fixes to improve quality using\nadvanced tools such as charm nt  quality center  and kanban to update status \nassociate systems analyst\n \n  \n01 1993\n \nto \n01 1996\n \ncompany name\npart of a team responsible for delivering over 100 000 files monthly pertaining to reporting and auditing and through the development of a\nbusiness plan that later migrated the delivery system to the internet saving the client considerable costs \norganized transactions over a six month period to install financial systems at pennsylvania hospital and temple university hospital \nbuild the programs required to successfully update system data to meet all deadlines consultant analyst\n \n  \n01 1983\n \nto \ncurrent\n \ncompany name\n \nï¼  \ncity\n \n  \nstat', 'University': 'e'}]","revenue cycle management, improve revenue cycle, shared medical systems, medical systems cerner, computer information systems, accomplished healthcare analyst, client clients client, highly accomplished healthcare, financials financial financial, financial system data"
./data\HEALTHCARE\18484846.pdf,HEALTHCARE,[],"city state physical, city state build, city state assist, city state plan, talented sales professional, city state talented, build client base, state physical education, city state aug, company demands efficiently"
./data\HEALTHCARE\18714571.pdf,HEALTHCARE,[],"primary resident care, provided primary resident, daily living activities, city state provided, state provided primary, maintained patient privacy, confidential patient information, state assisted patients, city state assisted, skilled healthcare company"
./data\HEALTHCARE\18784594.pdf,HEALTHCARE,"[{'Degree': 'master', 'Major': 's business administration\n \norganizational leadership\nmay 6  2017\nuniversity of findlay\n international business\n \nmba\n \ninternational business\nlean six sigma black belt certification\nmarch 31  2017\nuniversity of michigan\n \nhealth care administration\n \nbachelors of science\n \nhealth care administration\nmay 2015\nmercy college of ohio\n \nassociates of science\nmay 2013\nwayne county community college\n \nmagna cum laude\nactivities and honors\ni am an experienced corporate professional with 10 years of progressive accomplishments  and work history  i am highly diversified with\ninterpersonal skills  demonstrated leadership and a strategic thinker for efficient and effective problem solving  i have worked full time while\ncompleting my executive management mba with conferral date in may of 2017  my goal is to align and engage my broad  diverse skillset and\nexperience to contribute to meet and exceed plan budget goals  \ni seek a career opportunity that will leverage my unique skills and qualifications as\na business professional  my intent is to utilize my mba education and work history to establish a mutual relationship  which will impact the bottom\nline and provide a platform for my career growth and advancement   mba  general management coursework in accounting  financial\nmanagement and leadership  proven track record implementing successful leadership practices to motivate and manage staff   implemented and\ndirected 5s lean initiative to 127 employees   6 years of professional robust leadership and management experience \nskills\nbilling  call center  cms  client  customer service  forms  hiring  insurance  inventory  meetings  office  organizational  processes  protocols \nreceptionist  reporting  safety  scheduling  six sigma  social services  telephone  transportatio', 'University': 'n'}]","customer service experience, average call handle, client customer service, health care administration, customer service metrics, customer service forms, customer service representatives, resolved customer service, customer service issues, service incoming customers"
./data\HEALTHCARE\18949843.pdf,HEALTHCARE,"[{'Degree': 'bachelor', 'Major': 's of science\n \n  \n1 2002\n \ngpa  \ndean s list gpa  3 8\n \ndean s list gpa  3 8\nskills\naccounting  adobe  adr  analyst  auditing  billing  budget development  budgets  charts  contracts  cpt  crystal reports  customer satisfaction \ncustomer care  data analysis  database applications  databases  edit  email  financial  forms  government  grants  icd 9  leadership  legal  director \nmanaging  access  microsoft office suite  office  modeling  networking  organizing  organizational  policies  coding  project management  quality \nquality improvement  reporting  research  rms  scheduling  upgrades  validation  workflo', 'University': 'w'}]","electronic health record, eligible managed care, quality customer care, managed care contract, care contracts support, quality quality improvement, care contract analysis, city state worked, city state research, management quality quality"
