CV File,Category,Education,Top Skills
./data\HEALTHCARE\47996197.pdf,HEALTHCARE,[],"omnichannel marketing campaigns, marketing marketing promotions, support marketing campaigns, direct mail campaigns, digital marketing specialist, direct marketing campaigns, city state responsible, testing customer segmentation, specialist city state, marketing campaigns company"
./data\HEALTHCARE\49325370.pdf,HEALTHCARE,"[{'Degree': 'master', 'Major': 'new concepts quickly   initiate document control and processing information   high\nlevel customer service and detail oriented   report composing and document presentation   thorough investigation and monitoring   patrol\nand crowd control access\ncore qualifications\nmicrosoft office suite expert\npeople oriented\norganized\nexceptional communicator\ndeadline oriented\nschedule management\nreport analysis\nmedical terminology\nexperience\nhealthcare effectiveness data and information set coordinator  hedis \n \n08 2013\n \nto \ncurrent\n \ncompany name\n \ncity\n \n  \nstate\nhealthcare effectiveness data and information set coordinator  hedis   educate and inform members about past due clinical services that\nimprove member health outcomes and increase health plan hedis rates  make outbound calls to members  providing assistance with\nobtaining services by assisting with appointment scheduling  arranging transportation  and conducting reminder calls and or emails  conduct\nhedis provider chart request calls and faxes to support medical record capture for hedis supplemental data review and abstraction \nrecord and document all member and provider outreach activity using microsoft office suite applications and web based technology \nreview member health plan eligibility using georgia s medical management information system  mmis   review member claims data to\ndetermine need for services using the health plan proprietary information system  identify and refer members to internal programs and\nservices like case management and disease management  maintain strict confidentially and ensure compliance with health insurance\nportability and accountability act  hipaa  during all outreach activities \nmanaged incoming and outgoing calls for busy medical office \nsuccessfully established effective systems for record retention by creating database for daily correspondence tracking \nscheduled and confirmed appointments for entire management team \nloss prevention security officer\n \n12 2011\n \nto \n02 2013\n \ncompany name\n \ncity\n \n  \nstate\npartnered with local store management to meet strategic loss prevention objectives \nexecuted internal and external surveillances using state of the art detection and investigation systems \nprepared data for property and damage reports  recording malfunctioning of facility equipment  and attended weekly staff meetings to\ndiscuss the damage reports \ndetected and apprehend shoplifters  processing and recovering of merchandise  prepared case reports on theft details and maintained an\neffective relationship with local law enforcement agencies \nrepresented macy s in court proceeding related to apprehensions and ensured high execution of company security measures designed to\ncontrol store and shrink \ndeveloped staff training for designated stores \nsecurity officer\n \n07 2010\n \nto \n10 2011\n \ncompany name\n \ncity\n \n  \nstate\npatrolled designated areas watching for unusual conditions that create security concerns or safety hazards \nmonitored and authorized entrance and departure of employees  visitors  and other persons to guard against theft and maintain premise\nsecurity \ninvestigated  prepared reports  and maintained written logs on accidents  incidents  and suspicious activities \nanswered telephone calls  taking messages  and answered questions providing information during business and non business hours \nobserved departing personnel to protect against theft of company property and ensured authorized removal of property was conducted\nwithin appropriate client requirements \naccount receivables administrative assistant\n \n07 2007\n \nto \n10 2008\n \ncompany name\n \ncity\n \n  \nstate\ninvestigated discrepancies  issued debit memos  reviewed aging balance reports to identify past due accounts  collection calls  and month \nend close activities accounts receivable reconciliations  utilized collection screens to quickly analyze account and met department goals by reducing delinquency\nand controlling losses at a considerably high margin \nfielded all calls on 12  line multi phone system  responded to email and fax inquiries  managed mail and client trafficfor the body shop \nupgraded office filing system for improved efficiency in locating customer files  handled all official company correspondence  analyzed and\nreconciled all final billing statements to ensure the correct amount of funds were collected and applied before file closeout \ndisplayed excellent interpersonal skills and phone manner during interaction with insurance agents  co workers  and the public \ncalculated time cards for department employees in preparation of submitting payroll  collected and applied all funds received from various\ninsurance companies such as state farm  usaa  allstate and geico to the appropriate client auto claim accounts in a timely manner \ndetention specialist\n \n07 2002\n \nto \n10 2005\n \ncompany name\n \ncity\n \n  \nstate\nsupervised central control and tower controls in the detention center \ncompleted intake and release of detainees \ninteracted with defendants  attorneys and the general public  providing them imperative information \nprocessed accounting functions of paperwork in the bonding department \nperformed other duties as assigned \nanswered incoming outgoing calls on the \nswitchboard regarding inmates  custody issues and guided them by resolving their predicaments \nprobation case specialist\n \n07 2000\n \nto \n12 2001\n \ncompany name\n \ncity\n \n  \nstate\nretrieved criminal records to update history with new charges and probation status on various specialty systems \nmaintained statistical data concerning case processing activities for three probation officers and performed various financial transactions \nperformed other duties as assigned to include handing all incoming outgoing calls from magistrate court judges  attorneys  probation officers\nand the general public \nexperience\ncustomer service\n â \nhandled customers effectively by identifying needs  quickly gaining trust  approaching complex situations and resolving problems to\nmaximize efficiency \nhandled customers effectively by identifying needs  quickly gaining trust  approaching complex situations and resolving problems to\nmaximize efficiency \ndata reporting\n â \ncompiled statistical data  such as patient admissions  discharges  deaths  births and types of treatment given \ndocument organization\n â \ndeveloped and created effective filing system to accelerate paperwork processing \nmedical records\n â \nreviewed medical records for completeness  assembled records into standard order and filed records in designated areas according to\nalphabetic and numeric filing system \nmultitasking\n â \ndemonstrated proficiencies in telephone  e mail  fax and front desk reception within high volume environment \neducation\ncertified medical office assistant\n \n  \nmedical administration\n \n2009\n \nkennesaw state continuing education\n \ncity\n \n  \nstate\n \n  \nusa\nâ  medical office receptionist support specialist  patient scheduling  medical records documents  cms 1500 medical billing  medical\nterminology basic anatomy and physiology  specialized billing reimbursement  business skill and management  80 hour medical externship at\nwellstar medical center  certified cpr w aed\nskills\naccounts receivable  administrative assistant  basic billing  cms  excellent interpersonal skills  cpr  email  faxes  filing  law enforcement  loss\nprevention  medical billing  medical terminology  microsoft office suite  management information system  payroll  safety  scheduling staff\ntraining  switchboar', 'University': 'd'}]","medical billing medical, management information system, information set coordinator, healthcare effectiveness data, microsoft office suite, billing medical terminology, set coordinator hedis, medical management information, medical records documents, medical office assistant"
./data\HEALTHCARE\51777546.pdf,HEALTHCARE,"[{'Degree': 'master', 'Major': 'human resource management\n \nhuman resource management\nmay 2012\n \nnew jersey city university\n \nï¼  \ncity\n \n  \nstate\n \nbachelor of science\n \ncriminal justice\n \ncriminal justice\nskills\naccounting software  administrative  audio  benefits  c  contracts  client  data management  dc  documentation  senior management  forms \nfunctional  hiring  human resource  hr  inventory  invoicing  legal  materials  access  excel  microsoft office suite  office  outlook  powerpoint \npowerpoint presentations  win  word  newsletter  payroll  personnel  processes  recruiting  recruitment  reporting  research  scheduling  staffing \ntax  phone  training programs  video  website  websites  author  writte', 'University': 'n'}]","human resource management, management human resource, resource management human, microsoft office suite, city state administrative, management job application, data management job, hiring human resource, phone training programs, training programs video"
./data\HEALTHCARE\54934269.pdf,HEALTHCARE,"[{'Degree': 'master', 'Major': 's\n \n  \nhealth education\n \n  \n04 2019\n \ntouro university worldwide\n \n  \ncity\n \n  \nstate\n \nmaster s\n \n  \nhealth education\nbachelor s\n \n  \nhealthcare administraton\n \n  \n03 2018\n \ntouro university worldwide\n \n  \ncity\n \n  \nstate\n \nassociate\n \n  \nsocial   behavioral sciences\n \n  \n12 2015\n \nlos angeles southwest college\n \n  \ncity\n \n  \nstate\n \nbachelor s degree\n \n  \nhealthcare\n \nadministration at touro university  i had the opportunity to develop the skills and experience necessary to\nsucceed in public health and health education positions  examples of my relevanthighlights\ncpr  microsoft excel  microsoft office  child care  organizational skills  teaching  filing  english \ncustomer service  excel  developmental disabilities experience  microsoft word\ncertifications and licenses\nacademic\nbasic\ncatheterization\nchild care\nclerical\ncpr\ncritical thinking\ncustomer service\ndevelopmental disabilities\ndiagnosis\nenglish\nfiling\nhealth education\nmicrosoft excel\nexcel\nmicrosoft office\nmicrosoft word\norganizational skills\norganization skills\npublic health\nteacher\nteaching\ntelephone\nverbal communication\nwritten\nskills\ncpr  microsoft excel  microsoft office  child care  organizational skills  teaching  filing  english \ncustomer service  excel  developmental disabilities experience  microsoft word\ncertifications and licenses \nacademic  basic  catheterization  child care  clerical  cpr  critical thinking  customer service  developmental disabilities  diagnosis  english \nfiling  health education  in k  microsoft excel  excel  microsoft office  microsoft word  organizational skills  organization skills  public health \nteacher  teaching  telephone  verbal communication  written\nadditional information\nauthorized to work in the us for any employer\nsummary\nproviding general administrative back up and other duties  more than 5 years of clerical support  familiar and experienced with electronic filing\nsystems  various document management technologies  and scanning experience  knowledge of filing systems and standards  proficiency working\nwith document management systems  able to multi task and efficiently manage changing priorities  excellent organizational and analytical skills \nwith attention to detail', 'University': ''}]","excel microsoft office, behaviors utilizing positive, healthcare instructional assistant, microsoft excel microsoft, microsoft excel excel, excel excel microsoft, microsoft office microsoft, psychologist instructional assistant, city state work, city state perform"
./data\HEALTHCARE\56520872.pdf,HEALTHCARE,"[{'Degree': 'master', 'Major': 's degree\n \n  \nnursing  nurse educator\n \nherzing university\n \nnursing  nurse educator\n4 2014\nbachelor s degree\n \n  \nnursing\n \nsalem international university\n \nnursing magna cum laude\n7 2007\nnursing diploma\n \n  \ncertifications\n \nreading hospital school of nursing\n \ncertifications\n2 2016\nbls\n \ncnor\nactivities and honors\namerican nurses association  6 2016   present  aorn  2008   2012\nskills\nacute care  billing  case management  charts  chemotherapy  closing  coaching  client  clients  discharge planning  insurance  director  meetings \npresenting  quality  quest  reporting  supervising  telecommunication  wound car', 'University': 'e'}]","clients conditions reporting, monitor clients conditions, client services manager, city state maintain, surgical procedures accurately, staff monitor clients, surgical staff monitor, operating room anticipate, document patient information, procedures accurately record"
./data\HEALTHCARE\58879993.pdf,HEALTHCARE,"[{'Degree': 'bachelor', 'Major': 'of science\n \n  \nhealthcare administration\n \npennsylvania college of health sciences\n \n2017\n \ncity\n \n  \nstate\ncoursework in epidemiology\ncoursework in statistics\ncoursework in health care policy   planning\ncoursework in ethical issues in health care\nhigh school diploma\n \nnortheastern high school\n \n2010\n \ncity\n \n  \nstate\nrecipient of the york alumnae chapter of delta sigma theta academic award scholarship\nassistant editor of the literary   art magazine\npresident of diversity club\nmember of \ncure finders\n \nclub\npresidential classroom alumna\ncore qualifications\nsuperb communication skills\nexcellent interpersonal skills\nconflict resolution skillsâ \ncustomer and personal service\nmedical terminology\nevent planning and coordination\nbudgeting and financial management\nmicrosoft office suite multitasking problem solving\nself starterâ \naccomplished leaderâ \nknowledge of medicare  medicaid  eeoc  hippa  fmla   adaâ \nmanagement   marketing experience\nefficient under pressure\ncultural awareness and sensitivityâ \nstrong work ethicâ \nteam player with positive attitude\nwriting and grammar knowledge detailed oriented\nstrong analytic skillsâ \ndeadline drivenâ â  \nprofessional experience\nhealthcare marketing specialist\n \ncity\n \n  \nstate\n \ncompany name\n \n \n \njul 2017\n \nto \ncurrent\nanalyzed performance of marketing program to identify the best opportunities for optimization â \nestablished production schedules and communicated project to stakeholders â \nincreased patient traffic by 5 â \nmanaged all social media forums  including the company website  social networking applications and message boards â \nhealthcare admin intern\n \ncity\n \n  \nstate\n \ncompany name\n \n \n \nfeb 2017\n \nto \njun 2017\nscheduled appointments and registered patients \nrecorded and filed patient data and medical records \ndemonstrated analytical and problem solving ability to addressing barriers \ndirected patient flow during practice hours  minimizing patient wait time \noversaw implementation of an effective budgeting and accounting system that improved efficiency and reduced costs \ndeveloped a system of staff communication that ensured proper implementation of treatment plans and comprehensive patient care \ndeveloped the design and execution of a program that contributed to 5  growth of the organization \ncall center representitive\n \ncity\n \n  \nstate\n \ncompany name\n \n \n \njun 2016\n \nto \nsep 2016\ndemonstrated mastery of customer service call script within specified time frames \nmaintained up to date records at all times \nprovided cross training to \n4\n \nstaff members \nfacilitated information flow between customer service  account management operations  quality assurance  training and payroll departments\nto guarantee call center objectives were met  \ncustomer service representative\n \ncity\n \n  \nstate\n \ncompany name\n \n \n \njun 2015\n \nto \nsep 2015\ndemonstrated mastery of customer service call script within specified time frames maintained up to date records at all times \nbuilt customer loyalty by placing follow up calls for customers who reported product issues \nformulated and enforced service center policies  procedures and quality assurance measures \nsales associate\n \ncity\n \n  \nstate\n \ncompany name\n \n \n \njun 2014\n \nto \njan 2016\nestablish or identify prices of goods  services or admission  and tabulate bills using calculators  cash registers  or recommend  select  and\nhelp locate or obtain merchandise based on customer needs and or desires â \noptical price scanners \nbag or package purchases and wrap gifts \nexchange merchandise for customers and accept returns \nclean shelves  counters  and tables \nfront desk assistant\n \ncity\n \n  \nstate\n \ncompany name\n \n \n \nsep 2013\n \nto \nmay 2015\nhandled incoming and outgoing correspondence  including mail  email and faxes \nanswer queries regarding computers \ndrafted and typed grammatically correct office memos \nmanaging test reminder calls  photocopied all correspondence  documents and other printed materials \nretail customer service associate\n \ncity\n \n  \nstate\n \ncompany name\n \n \n \nmay 2011\n \nto \naug 2011\ngreet customers entering establishments \nassist customers by providing information and resolving their complaints \nreceive payment by cash  check  credit cards  vouchers  or automatic debits \nopen and close cash registers \nperforming tasks such as counting money  separating charge slips  coupons and vouchers \nplace special orders or call other stores to find desired items \ncompleted floor replenishment to guarantee size availability and promote customer satisfaction \nkept current on market and product trends to effectively answer customer questions \ntechnical skills\nelectronic \nmedical database\nmicrosoft \npowerpoint\nmicrosoft excel\nmicrosoft word\nmicrosoft \npublisher\nadobe \ndream weaver\nadobe photoshop\nmicrosoft \noutlook\nwindows\nadobe premiere\nadobe acrobat\ngimp\nadobe reader\ncommunity service\nfood drive  mount of salvation church  2012 â \nvolunteer  eco city farms  2014\nsocktober drive  mount of salvation church  2015\ndining room volunteer  so others can eat  some   2016â \nvolunteer  white rose senior center  2016   2017 â', 'University': ''}]","city state company, associate city state, customer service call, city state coursework, service call script, specialist city state, assistant city state, city state recipient, intern city state, representitive city state"
./data\HEALTHCARE\60624892.pdf,HEALTHCARE,"[{'Degree': 'bachelor', 'Major': 'of science\n \n  \noccupational therapy\n \n  \n5 2004\n \nmidwestern university\n \n  \ncity\n \n  \nstate\n \ngpa  \ngraduated suma cum laude gpa  3 6\n \noccupational therapy graduated suma cum laude gpa  3 6 most distinguished student  mwu \nclass of\nmasters of business administration\n \n  \nhealthcare management\n \n  \n6 2014\n \nuniversity of phoenix\n \n  \ngpa  \nphoenix arizona \ngraduate magnum cum laude gpa  3 89\n \nhealthcare management phoenix arizona \ngraduate magnum cum laude\ngpa  3 89\ngraduate certificate in accounting cpa exam candidate\n \n  \n3 2015\n \nskills\naccounting  acquisitions  art  balance  bridges  business operations  business plan  oral  cpa  client  customer satisfaction  documentation \nfinancials  financial  team building  leadership  director  marketing  market  memory  mentoring  mergers  network  nursing  policies \npresentations  processes  program development  quality  recruitment  reporting  sales  staffing  strategic  technical training  visio', 'University': 'n'}]","occupational therapy services, implementing occupational therapy, cum laude gpa, home care agencies, home health outpatient, interpreting evaluation needed, gross motor skills, development customer service, management program development, sensory dysfunction prescribing"
./data\HEALTHCARE\64471954.pdf,HEALTHCARE,[],"healthcare customer service, customer service representative, skills customer service, customer service roles, high customer service, customer service standards, customer service expert, alarm customer service, customer service manager, developed customer service"
./data\HEALTHCARE\69199666.pdf,HEALTHCARE,"[{'Degree': 'bachelor', 'Major': 'of science\n \n  \npsychology\n \nvirginia state university\n \n2002\n \ncity\n \n  \nstate\n \npsychologygeneral psychology  early education psychology  adolescent psychology  developmental psychology  psychology of learning  psychological\ntesting  abnormal psychology  sensation   perception  social psychology  psychological research  experimental psychology \n \ncompleted\nstudent work study assignment at the children s house on the campus of vsu  administered standardized intelligence  aptitude and personality\nassessment tests to children in the local community referred by local pediatricians   provided accurate and efficient results  maintained composure\nwith difficult or challenging patients  using the testing techniques to monitor and control all situations  learned benefits of pediatric\nneuropsychological tests  had the privilege of working with children diagnosed with autism spectrum disorder  adhd  and add  completed\nwork study program upon graduation  working in this program for four years  including summers \ncertified life coach expert rating online program\n \n2017\n \ncertified with specialization in career coaching  personal coaching \nrelationship coaching  virtual  face to face  and conference call services provided  workshops and seminars also offere', 'University': 'd'}]","city state company, specialist city state, recruiter city state, city state psychologygeneral, representative city state, recruiting specialist city, healthcare recruiter city, pricing phone team, coaching client clients, pricing psychology recruiting"
./data\HEALTHCARE\75297735.pdf,HEALTHCARE,[],"real estate title, estate title insurance, vice president business, including real estate, president business banking, business banking sales, banking sales manager, banking real estate, healthcare specialty banker, insurance real estate"
